place,title,time,pay,date
전북 익산시, 대교 눈높이 영등 러닝센터,11:00~20:00,"월급2,000,000",7분전
경기 성남시, 대교 눈높이 위례HL사업국,15:00~21:00,"연봉27,000,000",21분전
경기 의정부, 대교 눈높이 민락 러닝센터,11:00~20:00,"월급2,000,000",28분전
경기 고양시, 대교 눈높이 햇빛드림 러닝센터,13:00~20:00,"월급2,500,000",29분전
경기 고양시, 대교 눈높이 덕이 러닝센터,13:00~20:00,"월급2,500,000",29분전
경기 고양시, 대교 눈높이 성저 러닝센터,12:00~20:30,"월급2,500,000",30분전
인천 계양구, 대교 눈높이 인천북부HL사업국,시간협의,"월급2,000,000",34분전
부산 전체, 대교 눈높이 연지 러닝센터,13:00~20:00,"월급2,100,000",53분전
부산 전체, 대교 눈높이 수정 러닝센터,13:00~20:00,"월급2,100,000",53분전
부산 동구, 대교 눈높이 동일 러닝센터,13:00~20:00,"월급2,100,000",54분전
부산 전체, 대교 눈높이 광일 러닝센터,13:00~20:00,"월급2,100,000",55분전
충남 당진시, 대교 눈높이 당진HL사업국,13:00~20:00,"월급2,500,000",55분전
서울 노원구, 대교 눈높이 공릉 러닝센터,13:00~20:30,"월급2,000,000",1시간전
서울 성북구, 대교 눈높이 장위 러닝센터,13:00~20:30,"월급2,000,000",1시간전
서울 성북구, 대교 눈높이 길음 러닝센터,13:00~20:30,"월급2,000,000",1시간전
광주 서구, 대교 눈높이 광주상무HL사업국,13:00~21:00,"월급2,500,000",1시간전
경기 이천시, 대교 눈높이 이천북부HL사업국,14:00~21:00,"월급2,000,000",1시간전
서울 성북구, 대교 눈높이 정릉 러닝센터,13:00~20:30,"월급2,000,000",1시간전
경기 이천시, 대교 눈높이 이천북부HL사업국,14:00~21:00,"월급2,000,000",1시간전
강원 태백시, 대교 눈높이 (강원)태백동해BL,11:00~20:00,"월급2,500,000",2시간전
경남 진주시, 대교 눈높이 하대 러닝센터,11:00~20:00,"월급1,800,000",2시간전
경남 진주시, 대교 눈높이 평거 러닝센터,11:00~20:00,"월급2,500,000",2시간전
경남 진주시, 대교 눈높이 진주혁신 러닝센터,11:00~20:00,"월급1,800,000",2시간전
서울 마포구, 대교 눈높이 망원스카이 러닝센터,11:00~20:00,"월급2,000,000",2시간전
경남 진주시, 대교 눈높이 평거 러닝센터,11:00~20:00,"월급2,500,000",2시간전
경기 양주시, 대교 눈높이 양주고읍 러닝센터,11:00~20:00,"월급2,000,000",2시간전
경기 고양시, 대교 눈높이 목암 러닝센터,11:00~20:00,"월급2,000,000",2시간전
경남 진주시, 대교 눈높이 진주혁신 러닝센터,11:00~20:00,"월급1,800,000",2시간전
서울 마포구, 대교 눈높이 망원스카이 러닝센터,11:00~20:00,"월급2,000,000",2시간전
경북 안동시, 대교 눈높이 옥동영호 러닝센터,시간협의,"월급2,000,000",2시간전
경기 안산시, 대교 눈높이 한신 러닝센터,13:00~21:00,"월급2,500,000",2시간전
경기 안산시, 대교 눈높이 한신 러닝센터,13:00~21:00,"월급2,500,000",2시간전
경기 안산시, 대교 눈높이 한신 러닝센터,13:00~21:00,"월급2,500,000",2시간전
경기 안산시, 대교 눈높이 한신 러닝센터,13:00~21:00,"월급2,500,000",2시간전
경기 안산시, 대교 눈높이 한신 러닝센터,13:00~21:00,"월급2,500,000",2시간전
서울 동작구, 대교 눈높이 대방 러닝센터,13:00~20:00,"월급2,000,000",2시간전
서울 서초구, 대교 눈높이 방배제1 러닝센터,11:00~20:00,"월급2,500,000",2시간전
서울 성북구, 대교 눈높이 길음 러닝센터,13:00~20:30,"월급2,000,000",2시간전
서울 노원구, 대교 눈높이 공릉 러닝센터,13:00~20:30,"월급2,000,000",2시간전
서울 성북구, 대교 눈높이 정릉 러닝센터,13:00~20:30,"월급2,000,000",2시간전
서울 관악구, 대교 눈높이 행운보습 러닝센터,시간협의,"월급2,500,000",2시간전
서울 성북구, 대교 눈높이 장위 러닝센터,13:00~20:30,"월급2,000,000",2시간전
서울 금천구, 대교 눈높이 시흥벽산 러닝센터,11:00~21:00,"월급2,500,000",3시간전
서울 양천구, 대교 눈높이 신목 러닝센터,11:00~21:00,"월급2,500,000",3시간전
전북 군산시, 대교 눈높이 군산HL사업국,13:00~21:00,"월급2,000,000",3시간전
대구 서구, 대교 눈높이 서도 러닝센터,시간협의,"월급2,000,000",3시간전
경북 안동시, 대교 눈높이 옥동복주 러닝센터,시간협의,"월급2,000,000",5시간전
경기 전체, 대교 눈높이 양동HL사업국,14:00~21:00,"월급2,500,000",5시간전
전북 전체, 대교 눈높이 김제 BL사업국,시간협의,"월급2,500,000",5시간전
경기 시흥시, 대교 눈높이 시화배곧HL사업국,13:00~21:00,"월급2,000,000",7시간전
