place,title,time,pay,date
경기 평택시, 세븐일레븐 평택지산점,16:00~21:00,"시급8,720",1분전
경기 남양주, 세븐일레븐 남양주별내점,15:00~22:00,"시급8,720",3분전
대전 서구, 세븐일레븐 대전갈마하이점,12:00~20:00,"시급8,720",5분전
서울 전체, 세븐일레븐 목동힐스테이트점,23:00~06:00,"시급8,720",5분전
경기 광명시, 세븐일레븐 철산푸르지오점,22:00~08:00,"시급8,720",10분전
서울 강서구, 세븐일레븐 마곡6단지점,21:00~02:00,"시급8,720",10분전
경기 의정부, 세븐일레븐 민락건호점,시간협의,"시급8,720",10분전
경기 수원시, 세븐일레븐 수원파장점,22:00~08:00,"시급8,720",11분전
경기 고양시, 세븐일레븐 일산풍동두산점,14:00~18:00,"시급9,000",12분전
대구 북구, 세븐일레븐 대구태전원룸점,시간협의,"시급8,720",17분전
전남 목포시, 세븐일레븐 목포용당아름점,08:00~15:00,"시급8,720",18분전
서울 강남구, 세븐일레븐 역삼8호점,08:00~19:00,"시급8,800",19분전
강원 원주시, 세븐일레븐 원주호반점,12:00~19:00,"시급8,720",20분전
서울 전체, 세븐일레븐 합정2호점,07:00~12:00,"시급8,720",21분전
경기 부천시, 세븐일레븐 부천프린스점,23:00~09:00,"시급8,720",21분전
충남 천안시, 세븐일레븐 천안2산단점,08:00~16:00,"시급8,720",22분전
대전 전체, 세븐일레븐 대전문화삼성점,10:00~16:00,"시급8,720",23분전
광주 광산구, 세븐일레븐 광주우산중앙로점,시간협의,"시급8,720",24분전
서울 강남구, 세븐일레븐 강남언주로점,09:00~21:00,"시급8,720",30분전
경기 광명시, 세븐일레븐 안양유원지점,19:00~23:00,"시급8,720",30분전
서울 전체, 세븐일레븐 강남언주로점,21:00~07:00,"시급10,000",31분전
서울 광진구, 세븐일레븐 아차산프리미엄점,시간협의,"시급8,720",31분전
부산 동구, 세븐일레븐 부산일보점,22:00~08:00,"시급8,720",35분전
서울 마포구, 세븐일레븐 상암우리점,08:00~15:00,"시급8,720",35분전
울산 남구, 세븐일레븐 울산무거중앙점,24:00~07:00,"시급8,720",35분전
경북 경산시, 세븐일레븐 영대스타점,00:00~08:00,"시급8,720",37분전
경북 예천군, 세븐일레븐 예천동일스위트점,시간협의,"시급8,590",37분전
충북 전체, 세븐일레븐 청주산남원룸점,16:00~23:00,"시급8,720",37분전
서울 송파구, 세븐일레븐 풍납점,15:00~21:00,"시급8,720",39분전
경기 화성시, 세븐일레븐 화성봉담주공점,24:00~07:00,"시급8,720",40분전
서울 중랑구, 세븐일레븐 상봉망우점,11:00~08:00,"시급8,720",41분전
대구 달성군, 세븐일레븐 대구테크노점,24:00~07:00,"시급8,720",42분전
충남 천안시, 세븐일레븐 천안성정도원점,22:00~06:00,"시급8,720",43분전
경기 김포시, 세븐일레븐 김포헤리움점,22:00~08:00,"시급8,720",45분전
인천 부평구, 세븐일레븐 인천산곡한화점,23:00~08:00,"시급8,720",47분전
충남 천안시, 세븐일레븐 천인직산점,21:00~09:00,"시급8,720",47분전
경기 안산시, 세븐일레븐 안산고잔로점,23:00~08:30,"시급8,720",49분전
경북 경산시, 세븐일레븐 경산압량원룸점,18:00~02:00,"시급8,720",51분전
경기 김포시, 세븐일레븐 김포헤리움점,22:00~08:00,"시급8,720",52분전
충남 아산시, 세븐일레븐 아산푸드타운점,06:00~24:00,"시급8,720",52분전
대구 서구, 세븐일레븐 대구중리일신점,22:00~07:00,"시급8,720",54분전
전북 완주군, 세븐일레븐 전주노송점,시간협의,"시급8,720",54분전
충남 논산시, 세븐일레븐 논산건양대원룸점,20:00~08:00,"시급8,720",55분전
광주 서구, 세븐일레븐 광주풍암부영점,08:00~15:00,"시급8,720",57분전
대구 달서구, 세븐일레븐 대구중리일신점,07:00~14:00,"시급8,720",58분전
서울 중구, 세븐일레븐 소공점,22:00~05:00,"시급13,080",59분전
광주 서구, 세븐일레븐 광주풍암부영점,15:00~22:00,"시급8,720",1시간전
경기 수원시, 세븐일레븐 수원산남점,20:00~03:00,"시급8,720",1시간전
경기 수원시, 세븐일레븐 수원파장점,22:00~08:00,"시급8,720",1시간전
서울 영등포, 세븐일레븐 양평까뮤스퀘어점,23:00~07:00,"시급8,720",1시간전
